{
  "area": "Computer Science",
  "author": "Nuniversity",
  "difficulty": "intermediate",
  "duration": "4 weeks",
  "icon": "code",
  "en": {
    "title": "Introduction to Programming",
    "description": "Learn the fundamentals of programming with hands-on exercises and real-world projects",
    "difficulty": "Intermediate",
    "duration": "4 Weeks"
  },
  "pt": {
    "title": "Introdução à Programação",
    "description": "Aprenda os fundamentos da programação com exercícios práticos e projetos do mundo real",
    "difficulty": "Intermediário",
    "duration": "4 Semanas"
  },
  "es": {
    "title": "Introducción a la Programación",
    "description": "Aprende los fundamentos de la programación con ejercicios prácticos y proyectos del mundo real",
    "difficulty": "Intermedio",
    "duration": "4 Semanas"
  }
}