{
  "area": "Data & Analytics",
  "author": "Nuniversity",
  "difficulty": "intermediate",
  "duration": "12 weeks",
  "icon": "database",
  "en": {
    "title": "Building a Databricks Data Lakehouse on AWS: Unity Catalog to Production",
    "description": "End-to-end course for building and operating a production Databricks Lakehouse deployed on AWS, Unity Catalog governance, Delta Lake (ACID, CDF, liquid clustering), Auto Loader and Structured Streaming ingestion, Databricks Runtime/Photon transformation, Lakeflow/DLT pipelines, Databricks SQL serverless warehouses and Lakeview, workflows-as-code with asset bundles, data quality expectations, Delta Sharing and Marketplace, performance and DBU cost optimization, CI/CD with Terraform, and a full capstone reference architecture, with architecture diagrams, real customer cases, worked pricing examples, and practice questions.",
    "difficulty": "Intermediate",
    "duration": "12 Weeks"
  },
  "pt": {
    "title": "Construindo um Data Lakehouse com Databricks na AWS: do Unity Catalog à Produção",
    "description": "Curso de ponta a ponta para construir e operar um Databricks Lakehouse de produção implantado na AWS, governança com Unity Catalog, Delta Lake (ACID, CDF, liquid clustering), ingestão com Auto Loader e Structured Streaming, transformação com Databricks Runtime/Photon, pipelines Lakeflow/DLT, warehouses serverless do Databricks SQL e Lakeview, trabalhos como código com asset bundles, expectativas de qualidade de dados, Delta Sharing e Marketplace, otimização de desempenho e de custo em DBU, CI/CD com Terraform e uma arquitetura de referência completa de capstone, com diagramas de arquitetura, casos reais de clientes, exemplos de precificação e questões de prática.",
    "difficulty": "Intermediário",
    "duration": "12 Semanas"
  },
  "es": {
    "title": "Construyendo un Data Lakehouse con Databricks en AWS: de Unity Catalog a Producción",
    "description": "Curso de extremo a extremo para construir y operar un Databricks Lakehouse de producción desplegado en AWS, gobernanza con Unity Catalog, Delta Lake (ACID, CDF, liquid clustering), ingesta con Auto Loader y Structured Streaming, transformación con Databricks Runtime/Photon, pipelines Lakeflow/DLT, warehouses serverless de Databricks SQL y Lakeview, trabajos como código con asset bundles, expectativas de calidad de datos, Delta Sharing y Marketplace, optimización de rendimiento y de costo en DBU, CI/CD con Terraform y una arquitectura de referencia completa de capstone, con diagramas de arquitectura, casos reales de clientes, ejemplos de precios y preguntas de práctica.",
    "difficulty": "Intermedio",
    "duration": "12 Semanas"
  }
}
